270212205,simple,3365820403854,"Túi đựng rác gia đình , Bao đựng rác văn phòng 1kg 3 cuộn màu đen",1,0,visible,,"Làm từ nhựa cao cấp dẻo dai, thân thiện với môi trường, an toàn cho sức khỏe mọi ngườiTúi đựng rác có đường gân dễ xé.Màu sắc sáng và tối phù hợp đựng rác trong văn phòng, rác sinh hoạt,…Túi đựng r...",,2025-12-03,taxable,,1,,,no,no,,,,,1,,54000,54000,,,,https://salt.tikicdn.com/cache/750x750/ts/product/bf/1b/d9/1583b3da21e9db231db115d214f614f7.jpg,,,,,,,,,0
274054637,simple,5617249651359,Bình giữ nhiệt inox 316 Elmich EL8311 dung tích 800ml - Hàng Chính Hãng,1,0,visible,,"Thông tin sản phẩm1. Giữ nhiệt hoàn hảo với công nghệ hút chân không độc đáo, giữ lạnh đến 30h và giữ nóng đến 9h.2. Chất liệu inox 316 cao cấp, bền bỉ, chống ăn mòn, an toàn tuyệt đối cho sức khỏe.3...",,2025-12-03,taxable,,1,,,no,no,,,,,1,,352800,650000,,,,https://salt.tikicdn.com/cache/750x750/ts/product/3b/87/9e/a3262c09692855b9aeec97502c3434be.jpg,,,,,,,,,0
278722785,simple,1353007447152,Ô dù gấp ngược chống lật chống tia UV - Hàng Cao Cấp,1,0,visible,,"THÔNG SỐ CHI TIẾT SẢN PHẨM- Kích thước: tán rộng 105cmm, chiều dài cán 90cm- Định lượng: 400 gam- Chất liệu: vải chống thấm nước, chống tia UV- Dù có tiết kế mở ngược thông minh có nghĩa đỉnh dù n...",,2025-12-03,taxable,,1,,,no,no,,,,,1,,165000,165000,,,,https://salt.tikicdn.com/cache/750x750/ts/product/17/e0/ea/706e98085b027f67a3e673f5db913482.jpg,,,,,,,,,0
1408699,simple,2385989513443,Gối Memory Foam 50D Hình Dáng Thường Lock&Lock HLW112 (50 x 30 cm) - Trắng,1,0,visible,,"Gối Memory Foam Lock&Lock HLW112 là gối mút hoạt tính, loại mút mà các nhà khoa học NASA nghiên cứu, chế tạo để phục vụ cho các nhà du hành vũ trụ với mục đích làm giảm tối đa áp suất trong không ...",,2025-12-03,taxable,,1,,,no,no,,,,,1,,296000,472000,,,,https://salt.tikicdn.com/cache/750x750/media/catalog/producttmp/bc/aa/d4/61f43fc1929a9e908cc9b74a377b97c2.jpg,,,,,,,,,0
263705371,simple,3772042488771,"Gối hơi kê cổ bơm tự động, mềm mại, thiết kế hình chữ U giúp giảm đau cổ, có nút cài, phù hợp cho văn phòng và du lịch-Gối Hơi Du Lịch Thoáng Khí, Gối Hơi Chữ U Hỗ Trợ Cổ & Vai Khi Di Chuyển -Gối Du Lịch Thổi Hơi Chữ U-Gối Hơi Chữ U Siêu Nhẹ",1,0,visible,,"Gối kê cổ chữ U chống đau mỏi cổ vai gáy cho dân văn phòng, đi du lịch, tàu xe...Mô tả sản phẩm:Gối hơi du lịch chữ U là trợ thủ đắc lực cho những chuyến đi xa, những giờ nghỉ trưa tại văn phòng ...",,2025-12-03,taxable,,1,,,no,no,,,,,1,,79000,79000,,,,https://salt.tikicdn.com/cache/750x750/ts/product/7c/f2/13/e385e36ac565729889fe4b3f665628c9.jpg,,,,,,,,,0
277971184,simple,5664877530103,Móc áo trượt lớn Hara 177 - Inochi (lốc 5 cái),1,0,visible,,"Móc Áo Trượt Lớn Hara 177 - Giao Màu Ngẫu Nhiên là loại móc xoay 360 độ linh hoạt.Móc treo váy, áo dây.Hướng dẫn sử dụng: dùng để treo quần áoBảo quản: nơi khô ráo, thoáng mátMắc Áo treo quần áo...",,2025-12-03,taxable,,1,,,no,no,,,,,1,,29300,49000,,,,https://salt.tikicdn.com/cache/750x750/ts/product/a5/02/cc/ae49ff709f47164b051db32268ba3530.jpg,,,,,,,,,0
277857397,simple,4644665653528,Bình nước Inochi - Kita Fami 500ml,1,0,visible,,"Thông tin kỹ thuật Bình nước Inochi - Kita Fami 500ml:Kích thước: 77 x 74 x 136 mmKhối lượng: 87gChất liệu: Nhựa Tritan, PP, silicon, hạt màu ƯU ĐIỂM:- Sản phẩm được làm từ chất liệu nhựa Tritan...",,2025-12-03,taxable,,1,,,no,no,,,,,1,,78000,153636,,,,https://salt.tikicdn.com/cache/750x750/ts/product/40/c7/34/725a76d74b770da8c4f35b4b2501d70e.png,,,,,,,,,0
277610835,simple,3131582119669,Combo 10 Khay Giấy Bạc Lót Bếp Ga Chống Dầu Bắn Dễ Lau Chùi - HÀNG CHÍNH HÃNG MINIIN,1,0,visible,,"Combo 10 Khay Giấy Bạc Lót Bếp Ga Chống Dầu Bắn Dễ Lau ChùiCombo 10 khay giấy bạc lót bếp ga là giải pháp tiện lợi giúp bảo vệ bề mặt bếp của bạn khỏi dầu mỡ, vết bẩn và thức ăn bắn ra trong quá trì...",,2025-12-03,taxable,,1,,,no,no,,,,,1,,17480,19000,,,,https://salt.tikicdn.com/cache/750x750/ts/product/c1/f2/cf/848143f00b8a4c9f24ed4db5a61c0edc.png,,,,,,,,,0
277543040,simple,9450050094847,"Set  4 đế nhựa  chống rung ,chống ồn ,chống trượt  kê máy giặt ,tủ lạnh , ,độ bền cao phù hợp tất cả các loại máy ",1,0,visible,,"-Set 4 đế nhựa chống rung ,chống ồn ,chống trượt kê máy giặt ,tủ lạnh , ,độ bền cao phù hợp tất cả các loại máy -Xuất xứ : Việt NamĐặc điểm nổi bật:Chất liệu  nhựa : Giúp giảm rung hiệu quả, b...",,2025-12-03,taxable,,1,,,no,no,,,,,1,,109000,109000,,,,https://salt.tikicdn.com/cache/750x750/ts/product/3a/43/ff/5d1977dd6b75787f4f97bbe1f4636be5.jpg,,,,,,,,,0
186256012,simple,1788286212693,Vỏ gối nằm cotton tici Lidaco kích thước tiêu chuẩn (1 chiếc),1,0,visible,,"** Ưu điểm:– Sản phẩm có đường may khéo léo, chắc chắn.– Màu sắc nổi bật, an toàn cho sức khỏe gia đình bạn.– Dùng để thay đổi cho không gian phòng ngủ thêm phong phú hoặc để dùng kèm với bộ cũ của...",,2025-12-03,taxable,,1,,,no,no,,,,,1,,30000,50000,,,,https://salt.tikicdn.com/cache/750x750/ts/product/d5/df/87/a9fe7f1e72fb92ab03d6e0e393b37f1a.jpg,,,,,,,,,0
186558022,simple,9751312245078,Combo 10 Móc Dán Tường Treo Đồ Đa Năng Siêu Chịu Lực,1,0,visible,,"Combo 10 Móc Dán Tường Treo Đồ Đa Năng Siêu Chịu LựcMỗi miếng dán sử dụng keo cường lực, độ bám dính tốt, nhưng khách chỉ nên dán trên bề mặt tường mịn màng, không lồi lỗ để đảm bảo thời gian sử dụng...",,2025-12-03,taxable,,1,,,no,no,,,,,1,,19000,20000,,,,https://salt.tikicdn.com/cache/750x750/ts/product/aa/18/2e/56fc8add0dea8258be86c836a5e675dd.jpg,,,,,,,,,0
277438580,simple,7494212300843,"Màn dây Funu có cửa, cao cấp, chống muỗi an toàn, giúp giấc ngủ ngon - Hàng chính hãng",1,0,visible,,"Màn dây Funu ngăn muỗi lẻn vào tuyệt đối, mắt màn nhỏ ngăn côn trùng bò vào trong✅Thông tin sản phẩm:- Tên sản phẩm: màn tuyn- Xuất xứ: Việt Nam- Quy cách sản phẩm:- Chất liệu: 100% polyester...",,2025-12-03,taxable,,1,,,no,no,,,,,1,,180000,180000,,,,https://salt.tikicdn.com/cache/750x750/ts/product/1b/b2/23/768174695729f00892c37e3ba991da02.jpg,,,,,,,,,0
276413638,simple,2989713441175,"Ổ Cắm Điện Đa Năng DELI Sạc Nhanh TypeC USB PD20W 2-12 Ổ Vuông Dẹt Chịu Tải 2500W, Cầu Chì Tự Ngắt",1,0,visible,,"Ổ CẮM ĐIỆN ĐA NĂNG DELI CỔNG TYPE C SẠC NHANH PD 20W 2-12 Ổ CẮM, CHỊU TẢI 2500W, CẦU CHÌ TỰ NGẮT KHI QUÁ TẢI BH 36 THÁNG ĐẶC ĐIỂM SẢN PHẨM:Công Suất Tối Đa: 2500WChịu Nhiệt Lên Tới 750°CTích hợp ...",,2025-12-03,taxable,,1,,,no,no,,,,,1,,25000,45000,,,,https://salt.tikicdn.com/cache/750x750/ts/product/4d/b7/55/67bf5b35b0708b7cd4d316c68908d612.jpg,,,,,,,,,0
276267534,simple,7661692766685,"Hộp nhựa đựng đồ, đựng thực phẩm đa năng có nắp gài và quai xách tiện lợi nhựa PP trong suốt thương hiệu VIệt Nhật",1,0,visible,,"Hộp lạnh 2 quai Việt Nhật 3 size (6521), Hộp đựng thực phẩm, bảo quản thức ăn có quai xách tiện lợi Việc lưu trữ thực phẩm sống, rau củ quả hay thậm chí sữa mẹ chồng chéo chung trong tủ lạnh có thể g...",,2025-12-03,taxable,,1,,,no,no,,,,,1,,42445,80000,,,,https://salt.tikicdn.com/cache/750x750/ts/product/0d/73/47/16355ca9a6e9db40f357b7cf9bb72768.jpg,,,,,,,,,0
276075830,simple,2180731057644,Hộp thủy tinh kèm nắp silicone cho bé Baby Food LocknLock LNG058S2IVY - Dung tích 150ml x2,1,0,visible,,Đặc điểm sản phẩmViệc điều chỉnh lượng thức ăn cho từng bữa ăn của bé từ giai đoạn ăn dặm ban đầu(30ml) đến giai đoạn ăn thô sau đó (120ml ~) sẽ trở nên dễ dàng hơn Thủy tinh chịu nhiệt chịu được t...,,2025-12-03,taxable,,1,,,no,no,,,,,1,,131000,240000,,,,https://salt.tikicdn.com/cache/750x750/ts/product/ce/1c/ec/ed1e5f5925628f4297231f7dc4b0dbdf.png,,,,,,,,,0
276039291,simple,5684148603654,KHAY ĐỰNG TRỨNG THÔNG MINH 4 TẦNG LĂN TỰ ĐỘNG - HÀNG CHÍNH HÃNG [Được đồng kiểm],1,0,visible,,KHAY ĐỰNG TRỨNG THÔNG MINH 4 TẦNG LĂN TỰ ĐỘNG - HÀNG CHÍNH HÃNG [Được đồng kiểm]- Màu sắc: Kem- Kích thước: Kệ 4 tầng: 7.3x20x36cm- Chất liệu: Nhựa PET an toàn cho sức khỏeCÁC TÍNH NĂN...,,2025-12-03,taxable,,1,,,no,no,,,,,1,,45000,45000,,,,https://salt.tikicdn.com/cache/750x750/ts/product/e9/49/5e/743904b56dae3346813fd1d217047a05.jpg,,,,,,,,,0
275494002,simple,7948394816061,Bình đựng dầu LocknLock CKO208 - Dung tích 550ML,1,0,visible,,"Đặc điểm nổi bậtChứa đa dạng các loại gia vị : Dầu ăn, giấm, nước mắm hoặc nước tương, Đóng mở tự động: Thiết kế thông minh với nắp tự động mở khi nghiêng bình và tự động đóng khi đặt bình thẳng đứ...",,2025-12-03,taxable,,1,,,no,no,,,,,1,,203000,316000,,,,https://salt.tikicdn.com/cache/750x750/media/catalog/producttmp/64/94/66/5afc37122f36059215188c1462349a81.jpg,,,,,,,,,0
275496241,simple,5854497744965,"Móc Dán Tường Inox 304 Loại 1 Chân Chịu Lực Đến 20kg Kèm Miếng Dán Tráng Bạc Siêu Dính, Móc Dán Chịu Lực Loại Tốt",1,0,visible,,"ƯU ĐIỂM NỔI BẬT MÓC DÁN TƯỜNG CHỊU LỰC CAO CẤP INOX 304 CHỐNG RỈ SÉT- Móc dán tường siêu dính, siêu chắc chịu lực 10kg- Móc dính tường cơ động, dễ di chuyển lắp ở nhiều vị trí khác nhau.- Đầu móc t...",,2025-12-03,taxable,,1,,,no,no,,,,,1,,2000,3000,,,,https://salt.tikicdn.com/cache/750x750/ts/product/c7/e8/74/e32ec33384df8e96d26c09fdb3dca894.jpg,,,,,,,,,0
275356468,simple,2587449779662,"Combo 10 Móc Treo Quần Áo Chống Trượt Xoay 360 Đa Năng Móc Nhựa Cao Cấp Bền Bỉ Chịu Vật Nặng, Mắc Áo Nhựa Giao Màu Ngẫu Nhiên",1,0,visible,,"Móc treo quần áo chống trượt xoay 360 đa năng chất nhựa cao cấp bền bỉ chịu được vật nặng. Móc áo có thiết kế tối giản, tinh tế và đầy đủ công năng, móc treo quần áo khô và ướt chống trượt đa năng chấ...",,2025-12-03,taxable,,1,,,no,no,,,,,1,,38000,72000,,,,https://salt.tikicdn.com/cache/750x750/ts/product/cc/f4/18/275a51c060b11cf676e2183d6a1ba688.jpg,,,,,,,,,0
274752383,simple,6745790317640,Dao gọt bào sợi rau củ đa năng inox 304 bền bỉ Hobby Home Decor DCDN,1,0,visible,,Dao gọt bào sợi rau củ đa năng inox 304 bền bỉ Hobby Home Decor DCDN   Thông tin kỹ thuậtChất liệu: Inox 304Kích thước: 8.5* 18cmCông dụng: gọt bào sợi rau củ quảBảo hành 12 thángCó khắc...,,2025-12-03,taxable,,1,,,no,no,,,,,1,,85000,85000,,,,https://salt.tikicdn.com/cache/750x750/ts/product/2d/82/81/4d4c0186f35925922997af737592728d.jpg,,,,,,,,,0
274415049,simple,7356170311618,"Đèn pin laser 303 siêu sáng gồm pin, sạc và khóa - Đèn lazer 303 tia Xanh lá - Hàng chính hãng",1,0,visible,,"Đèn pin laser 303 siêu sáng gồm pin, sạc và khóa - Đèn lazer 303 tia Xanh lá - Hàng chính hãng.Bộ sản phẩm bao gồm:1 x đèn xanh trỏ laser1 x bộ sạc1 x sạc pin Li-ion1 x chìa khóa an toànĐặc điể...",,2025-12-03,taxable,,1,,,no,no,,,,,1,,159000,159000,,,,https://salt.tikicdn.com/cache/750x750/ts/product/80/71/6a/51a00b6c13cf5e6f48821fd39287400d.png,,,,,,,,,0
273979205,simple,3692107675242,"Gương Dán Tường Dẻo Chống Vỡ Chống Thấm Nước Tự Dính Trang Trí Nhà Cửa Gương Dán Nhà Tắm, Phòng Khách, Phòng Ngủ, Phòng Bếp",1,0,visible,,"➫ Thông số sản phẩm◆ Vật chất: Acrylic chất lượng cao◆ Màu sắc: Cao quý bạc◆ Phong cách: Modern Minimalism◆ Chức năng: Làm đẹp và trang trí◆ Không gian áp dụng: phòng khách, phòng ngủ, phòng tắm,...",,2025-12-03,taxable,,1,,,no,no,,,,,1,,29000,40000,,,,https://salt.tikicdn.com/cache/750x750/ts/product/a5/be/e7/202edcbc46cbbb6d055afefbdddd8efb.jpg,,,,,,,,,0
275719039,simple,6269354098589,Chảo sâu lòng chống dính đáy từ Tefal So Matcha,1,0,visible,,"Nồi chảo chống dính đáy từ Tefal So Matcha - Hàng chính hãng- Lớp chống dính Titanium bền gấp 2 lần theo tiêu chuẩn Tefal- Lớp chống dính an toàn không chứa PFOA, lead and cadmium. - Công nghệ độc đ...",,2025-12-03,taxable,,1,,,no,no,,,,,1,,652000,879000,,,,https://salt.tikicdn.com/cache/750x750/ts/product/91/5a/37/46c03e3c5e6a69558b97ea2de41e8656.png,,,,,,,,,0
253132715,simple,6315186263136,Kéo cộng lực chuyên dụng cắt xương gà hàng cao cấp GERMANY,1,0,visible,,THÔNG TIN SẢN PHẨM . Kéo cắt gà ZWILLING . Kéo cộng lực cắt xương gà xương vịt xương cá các loại thực phẩm cứng . Kéo đa năng cắt giấy cắt tôn kẽm rất hiệu quả . Kéo nhà bếp ZWILLING được làm từ t...,,2025-12-03,taxable,,1,,,no,no,,,,,1,,195000,250000,,,,https://salt.tikicdn.com/cache/750x750/ts/product/c2/a7/78/e7023ef006174be3fb88695a0e95bba2.png,,,,,,,,,0
53789449,simple,7787977696957,"Bộ cây lau nhà tự vắt thông minh, chổi lau nhà 360 độ, lau sạch khô nhanh - Parroti Pro PR01",1,0,visible,,BẠN MUỐN MUA THÊM SẢN PHẨM KHÁC CỦA PARROTI Bộ lau nhà ProMax - Size LớnThùng rác Parroti BinCọ bồn cầu Parroti Silicon Bộ cây lau nhà thông minh tự vắt Parr...,,2025-12-03,taxable,,1,,,no,no,,,,,1,,469000,469000,,,,https://salt.tikicdn.com/cache/750x750/ts/product/36/82/31/40994bfa1587bda48fc83ffa0bae5a6d.png,,,,,,,,,0
52885370,simple,4855271554921,1 Kg túi zip chỉ đỏ thương hiệu Gimex II,1,0,visible,,"Túi zipper đáy đứng dùng trong việc bảo quản thực phẩm, đựng đồ dùng trong gia đình hoặc được dùng để đựng linh kiện trong các ngành điện tử.Chiếc túi zipper bé nhỏ này sẽ giúp bạn phân chia hàng hóa,...",,2025-12-03,taxable,,1,,,no,no,,,,,1,,89000,89000,,,,https://salt.tikicdn.com/cache/750x750/ts/product/dc/c3/98/4a7cdcae3fc66f40890645b8d9c2e1ed.jpg,,,,,,,,,0
195902397,simple,7806848186380,"Combo 5 Cọ Rửa Ống Hút, Chổi Rửa Ống Nghiệm Đủ Kích Thước",1,0,visible,,"Combo 5 Cọ Rửa Ống Hút, Chổi Rửa Ống Nghiệm Đủ Kích Thước- Có nhiều độ dài và đường kính phù hợp với các loại ống hút, ống nghiệm và các loại dụng cụ khác nhau.- Thân cọ làm từ Inox, đảm bảo không rỉ...",,2025-12-03,taxable,,1,,,no,no,,,,,1,,23750,25000,,,,https://salt.tikicdn.com/cache/750x750/ts/product/b9/ae/d0/5fdd53ef41717d93c0812e5b2a0eb5d6.jpg,,,,,,,,,0
51476758,simple,9006334324882,"Bộ 10 đôi đũa inox 304 - 316 DandiHome 2020 chống trơn trượt, sang trọng, tinh tế",1,0,visible,,"Sản phẩm đũa Inox thực sự không phổ biến ở Việt Nam, đa phần lí do mọi người không dùng vì “TRƠN, KHÓ GẮP”. Nhưng với đũa Inox 304 / 316 kiểu mới nhất dưới đây của DandiHome, tất cả sự bất tiện đó sẽ...",,2025-12-03,taxable,,1,,,no,no,,,,,1,,300000,300000,,,,https://salt.tikicdn.com/cache/750x750/ts/product/e2/17/11/dd9d9e30480d010683deed91751f9ddf.jpg,,,,,,,,,0
186555778,simple,3578948238206,"Combo 5 Miếng Dán Chữ U Đa Năng Treo Ổ Điện, Treo Hộp Giấy",1,0,visible,,"Combo 5 Miếng Dán Chữ U Đa Năng Treo Ổ Điện, Treo Hộp GiấyLoại đơn: 6x6cm - Loại đôi: 6x12cmMỗi miếng dán sử dụng keo cường lực, độ bám dính tốt, nhưng khách chỉ nên dán trên bề mặt tường mịn màng, ...",,2025-12-03,taxable,,1,,,no,no,,,,,1,,14250,15000,,,,https://salt.tikicdn.com/cache/750x750/ts/product/aa/03/f4/a7d6ac9a63f29892edfba12d5b6c0676.jpg,,,,,,,,,0
185922612,simple,5671967858379,Cốc Thủy Tinh Hai Lớp Cách Nhiệt Ly Đựng Cà Phê Trà Trang Nhã,1,0,visible,,Cốc Thủy Tinh Hai Lớp Cách Nhiệt Ly Đựng Cà Phê Trà Trang NhãChất liệu thủy tinh chịu nhiệt high borosilicate an toàn cho sức khỏe và môi trườngThiết kế đơn giản thanh lịch phù hợp cho nhiều loại th...,,2025-12-03,taxable,,1,,,no,no,,,,,1,,79000,79000,,,,https://salt.tikicdn.com/cache/750x750/ts/product/04/03/83/1eaff1278844ec4e4a4ad859cc6778cf.jpg,,,,,,,,,0
176592359,simple,7709895792159,Cây lau nhà tự vắt đa năng Sunhouse KS-MO3211PW,1,0,visible,,"Chất liệu nhựa PP siêu bền, an toànCây lau nhà tự vắt đa năng Sunhouse KS-MO3211PW được thiết kế tiện dụng với tay cầm và đầu cây lau bằng nhựa PP chắc chắn, chịu lực tốt và hạn chế trầy xước giúp câ...",,2025-12-03,taxable,,1,,,no,no,,,,,1,,186000,263000,,,,https://salt.tikicdn.com/cache/750x750/ts/product/4b/c2/72/d9dbc758553533563879bacccdb4761b.jpg,,,,,,,,,0
132064561,simple,1889603277037,"Combo 3 Thanh Treo Đồ Dán Tường, Tủ Quần Áo, Nhà Bếp, Có 6 Móc Chịu Lực (giao màu ngẫu nhiên) - Chính Hãng ",1,0,visible,,"Móc dán tường 6 móc 34.5x6cm dán tường nhà tắm nhà bếp với 6 móc di động siêu chắc không khoan đụcMóc dán tường 6 móc 34.5x6cm với kiểu dáng nhỏ gọn, mỏng nhẹ tiện lợi, là trợ thủ đắc lực giúp tiết ...",,2025-12-03,taxable,,1,,,no,no,,,,,1,,69690,138000,,,,https://salt.tikicdn.com/cache/750x750/ts/product/f7/f0/e4/05c1aedfaab1e2ab5ce906aab1520865.jpg,,,,,,,,,0
118898225,simple,3124860681600,Trung Nguyên Legend - Phin nhôm hoa văn màu đen Vĩ Nhân - có hộp giấy (giao mẫu ngẫu nhiên),1,0,visible,,"PHIN NHÔM HOA VĂN MÀU ĐEN VĨ NHÂN - CÓ HỘP GIẤY GIỚI THIỆU SẢN PHẨM:- Phin cà phê chất liệu nhôm cao cấp in hoa văn Doanh nhân rất tinh tế. - Phin với nhiều màu đen sang trọng và huyền bí,giúp khá...",,2025-12-03,taxable,,1,,,no,no,,,,,1,,107018,107018,,,,https://salt.tikicdn.com/cache/750x750/ts/product/01/fd/77/fedd4f6d0a4c5623dc4fcab012e83c9e.jpg,,,,,,,,,0
2130501,simple,6966014349662,Bình Đựng Dầu Với Nắp Mở Tự Động Lock&Lock CKO101BLK (550ml),1,0,visible,,"Bình Đựng Dầu Với Nắp Mở Tự Động Lock&Lock CKO101BLK được làm từ chất liệu thủy tinh an toàn, chịu nhiệt và chịu va đập tốt, có bề mặt nhẵn mịn, thuận tiện cho người sử dụng.Sản phẩm có nắp đ...",,2025-12-03,taxable,,1,,,no,no,,,,,1,,141000,258000,,,,https://salt.tikicdn.com/cache/750x750/media/catalog/producttmp/ab/77/7a/93066c4f1bd966b126885d0311a346a4.jpg,,,,,,,,,0
112760342,simple,9611226902335,"Thùng rác treo tủ bếp có nắp đậy thông minh, thùng rác treo tường dán tường, có thanh trượt cửa bếp – Parroti Bin BN02",1,0,visible,,"Thùng rác treo tủ bếp có nắp đậy thông minh – Parroti Bin BN02Thùng rác treo tủ Parroti Bin BN02 là một sản phẩm đột phá của hãng, thùng rác có thể được treo gọn gàng trước cửa tủ bếp bằng thanh ray...",,2025-12-03,taxable,,1,,,no,no,,,,,1,,189000,189000,,,,https://salt.tikicdn.com/cache/750x750/ts/product/9b/a6/38/5b0f282b4e89dfe722a32521867d9641.jpg,,,,,,,,,0
201842572,simple,1084323614195,"Võng Mùng Quân Đội - Võng Mùng Du Lịch Chống Muỗi 3 Lớp Cao Cấp - Võng Mùng Quang Phương  - Chất Liệu Vải Dù Lán Bóng, Mềm Mịn Có Tác Dụng  Chống Muỗi Và Các Loại Côn Trùng. Thiết Kế Nhỏ Gọn Thuận Lợi Cho Các Chuyến Du Lịch Dã Ngoại.",1,0,visible,,"Võng Mùng Quân Đội - Võng Mùng Du Lịch Chống Muỗi 3 Lớp Cao Cấp - Võng Mùng Quang Phương - Chất Liệu Vải Dù Lán Bóng, Mềm Mịn Có Tác Dụng Chống Muỗi Và Các Loại Côn Trùng. Thiết Kế Nhỏ Gọn Thuận Lợi...",,2025-12-03,taxable,,1,,,no,no,,,,,1,,160000,160000,,,,https://salt.tikicdn.com/cache/750x750/ts/product/48/f9/7b/48a8af65a59906e051dffe958058ee68.jpg,,,,,,,,,0
90446530,simple,5910761108970,"Bàn để ủi đồ, quần áo dạng đứng gấp gọn PRESSY khung kim loại, màu xám | Index Living Mall | Nhập khẩu Thái Lan",1,0,visible,,"Bàn để ủi đồ, quần áo dạng đứng gấp gọn PRESSY Kích thước : 30x90x60 cm | Index Living Mall | Nhập khẩu Thái Lan Thông tin chi tiết- Tên sản phẩm : PRESSY- Mã sản phẩm : 170072065- Chất liệu sản phẩm...",,2025-12-03,taxable,,1,,,no,no,,,,,1,,699000,699000,,,,https://salt.tikicdn.com/cache/750x750/ts/product/1e/c3/ce/ebd32ffcaa8e3bdb8d7207e4ab69c1be.jpg,,,,,,,,,0
71999231,simple,5972668858512,Nồi Inox 3 Lớp Đáy Liền Elmich Trimax Classic,1,0,visible,,Nồi Inox 3 Lớp Đáy Liền Elmich Trimax Classic 2405OL Size 16cmNồi Inox 3 Lớp Đáy Liền Elmich Trimax Classic 2406OL Size 18cmNồi Inox 3 Lớp Đáy Liền Elmich Trimax Classic 2407OL Size 20cmNồi Inox 3 Lớp...,,2025-12-03,taxable,,1,,,no,no,,,,,1,,446000,825000,,,,https://salt.tikicdn.com/cache/750x750/ts/product/d1/ba/b0/1906bfd95089f54263de26dec5ab4b11.jpg,,,,,,,,,0
276848790,simple,2458642812626,Hộp 2 lọ Tinh dầu đuổi muỗi nhật bản 60 ngày,1,0,visible,,inh dầu đuổi muỗi Nhật lọ thay thế được sản xuất tại Nhật Bản với chiết xuất từ thiên nhiên có tác dụng đuổi muỗi bằng cơ chế sử dụng công nghệ bốc hơi tinh dầu dưới dạng ion làm ức chế phổi của muỗi ...,,2025-12-03,taxable,,1,,,no,no,,,,,1,,250000,250000,,,,https://salt.tikicdn.com/cache/750x750/ts/product/10/76/6d/d83cf91145042c355e418a89c6baedd9.jpg,,,,,,,,,0
112062210,simple,5226147736956,"Máy ép trái cây bằng tay FRU-227, Ép táo, lựu, bưởi, dưa, thơm Dụng cụ Ép cam chuyên dụng",1,0,visible,,Màu sắcNhư hình đại diệnKhối lượng0.8 kgKích thước (Dài x rộng x cao)Sản phẩm : 22.7 * 13 x 10.5 cm / Hộp : 25 x 14 x 12 cmQuy cáchĐóng hộpChất liệuNhôm hợp kimĐộ bền> 5 năm...,,2025-12-03,taxable,,1,,,no,no,,,,,1,,139000,139000,,,,https://salt.tikicdn.com/cache/750x750/ts/product/da/fb/fe/545398dc2f2aebf05e906c49540b2503.jpeg,,,,,,,,,0
72079089,simple,6958561807658,Pin Sạc AA 2000mAh NH15 Power Plus RP2 Energizer NH15 RP2 (Mẫu mới),1,0,visible,,Thông tin cơ bản Pin Sạc AA 2000mAh NH15 Power Plus RP2 Energizer NH15 RP2:Dung lượng: 2000mAh tuổi thọ cao và thời gian chờ lên đến 1 nămĐiện áp: 1.2V/1viênThiết kế để đảm bảo thời lượng pin dài...,,2025-12-03,taxable,,1,,,no,no,,,,,1,,185000,185000,,,,https://salt.tikicdn.com/cache/750x750/ts/product/c0/2b/9d/588e33073403caa3efc0f9b3353aa65d.jpg,,,,,,,,,0
225947130,simple,7499501961786,5 Viên Pin CR2025 3V Panasonic Lithium made in Indonesia - Hàng chính hãng,1,0,visible,,Hàng năm có khoảng 600 triệu viên pin bị vứt bỏ. Số lượng pin này xếp dài ra sẽ tương đương quãng đường từ Anh sang Úc!Pin có nhiều loại với nhiều kích thước khác nhau: Có viên pin có kích thước chỉ n...,,2025-12-03,taxable,,1,,,no,no,,,,,1,,75000,75000,,,,https://salt.tikicdn.com/cache/750x750/ts/product/fe/66/a2/86475c8588985614851219628de705b3.png,,,,,,,,,0
15605818,simple,6944662579082,Bộ Dao Nhà Bếp 5 Món Cookplus Lock&Lock CKK101S5BLK,1,0,visible,,"Bộ Dao Nhà Bếp 5 Món Cookplus Lock&Lock CKK101S5BLKBộ sản phẩm gồm 5 món: 4 con dao, 1 dụng cụ gọt vỏ trái cây. Tiện dụng và phù hợp với nhu cầu đa dạng.Thiết kế và màu sắc trang nhã, đẹp mắt,...",,2025-12-03,taxable,,1,,,no,no,,,,,1,,168000,309000,,,,https://salt.tikicdn.com/cache/750x750/media/catalog/producttmp/07/3d/53/f50ad18195280ec6f966b3ad6e17f67c.jpg,,,,,,,,,0
14605515,simple,6877748871117,Nắp Kính Cường Lực Fivestar Nồi Và Chảo,1,0,visible,,Nắp Kính Cường Lực Fivestar Nồi Và Chảo#nắpkínhNắp kính cường lực Fivestar dùng cho nồi chảo quánh ( 16 cm / 18cm / 20cm /24cm / 26cm /28cm /30cm / 32cm )- Nắp vung kính trong suốt giúp dễ dàng qua...,,2025-12-03,taxable,,1,,,no,no,,,,,1,,100000,100000,,,,https://salt.tikicdn.com/cache/750x750/ts/product/d4/e0/3e/a317fd25fbc68d1aad75314779228bc5.jpg,,,,,,,,,0
276944889,simple,7217386784178,Combo 10 móc treo đồ dán tường,1,0,visible,,"Dấu không có keo, không đục lỗ, lắp đặt dễ dàngVật dụng có thể treo, chống thấm nước và chống ẩm, không sợ môi trường ẩm ướt như nhà bếp và phòng tắmKhả năng chịu tải mạnh, bám dính chắc và độ bền...",,2025-12-03,taxable,,1,,,no,no,,,,,1,,28000,28000,,,,https://salt.tikicdn.com/cache/750x750/ts/product/40/b3/36/59ed24f75f71f49b3cba16c2427a2b2a.png,,,,,,,,,0
