270211236,simple,4030979910057,TÚI ĐỰNG RÁC MÀU 1KG 3 CUỘN TỰ HỦY,1,0,visible,,"- Túi đựng rác được làm từ chất liệu nilong cao cấp dẻo dai, có khả năng tự phân hủy, vô cùng thân thiện với môi trường, an toàn cho người sử dụng.- Kích thước túi lớn, chứa được nhiều rác nên vô cùn...",,2025-12-03,taxable,,1,,,no,no,,,,,1,,52000,82000,,,,https://salt.tikicdn.com/cache/750x750/ts/product/b5/5e/c7/26d480c4edafb8eed8e2b8de3ab2e523.jpg,,,,,,,,,0
186557922,simple,9938704315012,"Túi 100 Dây Rút, Lạt Nhựa (Trắng/Đen) Siêu Bền Để Làm Vườn, Thi Công Tiện Lợi",1,0,visible,,"Chất liệu: Nylon PA66 bền, dẻo dai, chịu nhiệt tốt, có thể sử dụng ngoài trời.Kích thước: có nhiều độ dài từ 10, 15, 20, 25, 30, 40cm.Số lượng: 100 dây/góiDây rút nhựa được sử dụng thay thế các loại...",,2025-12-03,taxable,,1,,,no,no,,,,,1,,17525,19500,,,,https://salt.tikicdn.com/cache/750x750/ts/product/8e/73/79/9894bec5670b65908bba684076fc64a1.jpg,,,,,,,,,0
196362419,simple,1311884382497,"Máy cắt cỏ, tỉa cành cầm tay LAPUSEN pin khủng 15000mah, động cơ mạnh 1800w",1,0,visible,,"* THÔNG TIN SẢN PHẨM:- ĐỘNG CƠ MẠNH MẼ: Máy cắt cỏ LAPUSEN 36V sử dụng động cơ 100% lõi đồng nguyên chất cho hiệu suất làm việc vượt trội. Động cơ công suất cao tới 1800W, tích hợp microchip điều áp c...",,2025-12-03,taxable,,1,,,no,no,,,,,1,,888000,888000,,,,https://salt.tikicdn.com/cache/750x750/ts/product/fc/b4/d0/162fba6d5367b4a628135ad5899412ea.png,,,,,,,,,0
148026926,simple,4942053429546,Bình Đựng Nước 2L Dễ Thương Có Vạch Báo Giờ Uống Nước - Hàng Loại 1 - Chính Hãng MINIIN,1,0,visible,,Bình Đựng Nước 2L Dễ Thương Có Vạch Báo Giờ Uống Nước - Hàng Loại 1 - Chính Hãng MINIINQuý khách lưu ý: Sản phẩm có nắp tròn và nắp vuông shop gửi ngẫu nhiên.Bình nước chắc chắn là một vật dụng khô...,,2025-12-03,taxable,,1,,,no,no,,,,,1,,74000,74000,,,,https://salt.tikicdn.com/cache/750x750/ts/product/ed/e6/c0/1065577a26374bc11da92d3afc8768dc.png,,,,,,,,,0
188379999,simple,1887011055285,Cốc Giữ Nhiệt Coffeeholic Teement Inox 304 Dung Tích 510ml Cao Cấp Kiểu Dáng Hàn Quốc Cầm Tay Sang Trọng- Hàng Chính Hãng,1,0,visible,,Cốc Giữ Nhiệt Coffeeholic Teement Inox 304 Dung Tích 510ml Cao Cấp Kiểu Dáng Hàn Quốc Cầm Tay Sang Trọng- Hàng Chính HãngMÔ TẢ SẢN PHẨMSang trọng- hàng chính hãngThông tin sản phẩm cốc giữ nhiệt cof...,,2025-12-03,taxable,,1,,,no,no,,,,,1,,150000,150000,,,,https://salt.tikicdn.com/cache/750x750/ts/product/e9/1e/ce/26c68661e054e3112c066b3e0f8b02a8.png,,,,,,,,,0
191805767,simple,1205735690979,"Đất Trồng Cây GreenHome, Lavamix, Bao 6.5dm3 (3kg), Đầy Đủ Dinh Dưỡng, Chuyên Trồng Rau, Hoa, Kiểng",1,0,visible,,"GIÁ SỈ SIÊU LỢI:Bao 6,5dm3Giá chỉ còn 12k  Số lượng: 200 baoGiá chỉ còn 14k  Số lượng: 100 bao Đất trồng cây Lavamix, đất hữu cơ trồng rau, hoa, kiểng, tiện lợi, dễ sử dụng |Greenhome  ĐẶC ĐI...",,2025-12-03,taxable,,1,,,no,no,,,,,1,,19900,36000,,,,https://salt.tikicdn.com/cache/750x750/ts/product/2a/09/a0/ebdced67bc74e3e5f1394b034bb9d817.png,,,,,,,,,0
212924705,simple,8416778970881,"Bộ 3 Chậu nhựa trồng cây, nhiều kích thước, thoát nước tốt, đa dạng kích thước trồng cây, hoa, kiểng lá |Greenhome",1,0,visible,,"Chậu nhựa trồng cây, đa dạng kích thước, nhựa cứng, thoát nước tốt, trồng cây, hoa, kiểng lá |Greenhome  ĐẶC ĐIỂM NỔI BẬT:- Chậu nhựa cứng thoát nước tốt là giải pháp hoàn hảo cho các loại cây ...",,2025-12-03,taxable,,1,,,no,no,,,,,1,,15000,24500,,,,https://salt.tikicdn.com/cache/750x750/ts/product/97/51/2c/cf63d600956334b6432b2f046a8f583b.jpg,,,,,,,,,0
199691117,simple,3301881152929,"Bó 100 Dây Thít, Dây Rút, Lạt Nhựa Đủ Mọi Kích Cỡ Tiện Lợi",1,0,visible,,...,,2025-12-03,taxable,,1,,,no,no,,,,,1,,8999,8999,,,,https://salt.tikicdn.com/cache/750x750/ts/product/33/22/9f/7dfbfa6a8e458dbfe0c27d0c8be49bca.jpg,,,,,,,,,0
190515682,simple,7682547688852,"Dây Buộc Cành GreenHome, Dài 50m, Kẽm Bọc Nhựa, Tích Hợp Đầu Cắt Tiện Lợi, Cố Định Thân Cây, Làm Giàn Leo",1,0,visible,,"GIÁ SỈ SIÊU LỢI:Giá chỉ còn 19k Số lượng: 100 cáiGiá chỉ còn 20,5k Số lượng: 50 cái ĐẶC ĐIỂM NỔI BẬT- Với đặc tính dây kẽm bọc nhựa hình dẹp nên dễ dàng buộc chặt cũng như tháo gỡ.- Sản phẩm nhỏ...",,2025-12-03,taxable,,1,,,no,no,,,,,1,,34900,43020,,,,https://salt.tikicdn.com/cache/750x750/ts/product/b6/c3/7a/82e0210f6f93dae96904067ea3f86fa2.jpg,,,,,,,,,0
108605080,simple,7746095781734,Pin kiềm Akaline AA Deli - Vỉ 2 viên/ 4 viên - 18500 / 18501,1,0,visible,,"TÍNH NĂNG SẢN PHẨM:️Pin kiềm Akaline mạnh mẽ, đầy đủ các chức năng và nguồn điện dồi dào. Phù hợp với nhiều nhu cầu sử dụng:️Các đồ vật phù hợp khi sử dụng với pin DeliĐồ chơiĐồng hồ báo thứcChuột máy...",,2025-12-03,taxable,,1,,,no,no,,,,,1,,29000,52200,,,,https://salt.tikicdn.com/cache/750x750/ts/product/59/e6/60/03baef5cbc9b9caf33390e4062dba1ec.jpg,,,,,,,,,0
89308772,simple,3749987924278,Thước Dây Deli Có Thể Làm Móc Chìa Khóa- Dài 1.5M - Thước Dây Cuộn - Màu Trơn Xanh Lá / Xanh Dương / Hồng / Trắng  - 1 Chiếc,1,0,visible,,THÔNG TIN CHI TIẾT: Thước Dây DeliĐộ dài 1.5 mSố đo trên 2 mặt thước theo 2 đơn vị: inch và cmĐường kính: 4.2 cmSản phẩm được sử dụng với nhiều mục đích khác nhau trong việc đo lường️Kích thước ...,,2025-12-03,taxable,,1,,,no,no,,,,,1,,29000,63000,,,,https://salt.tikicdn.com/cache/750x750/ts/product/45/6b/f3/2bcfe1a84ce80302a9f043645bfeafe5.jpg,,,,,,,,,0
75340685,simple,1378631752001,"Hộp Đựng Đồ Đa Năng TD1 – Túi Vải Đựng Quần Áo Chăn Màn Phong Cách Thụy Điển Sang Trọng, Lịch Sự – Hàng Chính Hãng",1,0,visible,,"Hộp Đựng Đồ Đa Năng TD1 Sang Trọng, Lịch SựTúi Vải Đựng Quần Áo Chăn Màn Phong Cách Thụy ĐiểnHàng Chính Hãng miDoctorKích thước 38 x 25 x 25cm Nắp liền hộp - Vải không dệt               Công dụn...",,2025-12-03,taxable,,1,,,no,no,,,,,1,,84000,160000,,,,https://salt.tikicdn.com/cache/750x750/ts/product/ef/7a/4d/39dc0d04031686c69245b4283cf9ec9a.jpg,,,,,,,,,0
197560900,simple,8441934218580,"Ghế chỉnh dáng ngồi đúng - Roichen Hàn Quốc (Made in Korea). Dùng cho Nam, Nữ, Trẻ em. Hàng chính hãng",1,0,visible,,"Sản phẩm của công ty Roichen Hàn Quốc - Sản xuất tại Hàn Quốc Công ty đã nhận được rất nhiều giải thưởng như Red Award, Design Award, Sản phẩm được người tiêu dùng bình chọn: 2011-2019 tại Hàn Quốc...",,2025-12-03,taxable,,1,,,no,no,,,,,1,,785000,785000,,,,https://salt.tikicdn.com/cache/750x750/ts/product/21/66/df/7ad1aae31d86474d86d3494d3f804967.png,,,,,,,,,0
119112668,simple,6514509534108,Combo 2 Miếng Lau Nhà Parroti ProMAX - Kích Thước 38 x12 CM,1,0,visible,,"Combo 2 Miếng Lau Nhà Parroti ProMAX PAD-PX01 - Kích Thước 38 x12 CMLưu ý: Miếng lau này chỉ dùng được cho Cây lau nhà Parroti ProMAX- CHẤT LIỆU MICRIFIBER: Siêu bền, hút nước tốt, lau cực sạch m...",,2025-12-03,taxable,,1,,,no,no,,,,,1,,159000,159000,,,,https://salt.tikicdn.com/cache/750x750/ts/product/a5/29/fb/1c59a276b8eb6c2c73189449128b053e.jpg,,,,,,,,,0
82190112,simple,8415369249913,Chảo chống dính đáy từ Elmich 4703OL size 20cm,1,0,visible,,"Lòng chảo chống dính bền bỉ, an toànBề mặt lòng chảo phủ 2 lớp chống dính Xylan màu đen ánh kim siêu bền của Whitford (Hoa Kỳ). Đây là loại chống dính an toàn tuyệt đối cho sức khỏe, không chứa các ...",,2025-12-03,taxable,,1,,,no,no,,,,,1,,159000,450000,,,,https://salt.tikicdn.com/cache/750x750/ts/product/44/d3/32/86e33c18ae32cbe726cf8cb305043288.jpg,,,,,,,,,0
69193093,simple,4062143161778,Bộ đầu nối vòi rửa chén tăng áp 3 chế độ Hobby Home Decor VSTADAY có khớp nối,1,0,visible,,Bộ đầu nối vòi rửa chén tăng áp 3 chế độ Hobby Home Decor VSTADAY có khớp nốiThông tin kỹ thuậtChất liệu nhựa ABSCó dây nối dài - thân mềmXoay được 360Có 3 chế độ phunGiúp tăng áp lực nước ...,,2025-12-03,taxable,,1,,,no,no,,,,,1,,89000,99000,,,,https://salt.tikicdn.com/cache/750x750/ts/product/2f/86/e7/ae3caeb285d27145f8f866148a45f0d0.jpg,,,,,,,,,0
99212527,simple,7828812867999,"Bộ nồi inox đáy từ cao cấp FiveStar Plus FS08CG-304 nắp kính 4 chiếc,inox 304 , tặng 1 vá canh",1,0,visible,,...,,2025-12-03,taxable,,1,,,no,no,,,,,1,,2610000,2610000,,,,https://salt.tikicdn.com/cache/750x750/ts/product/41/a0/e8/55ea5a1e1f563d6f89bc2afd5230b180.jpg,,,,,,,,,0
51105288,simple,9083400936828,Bộ 4 ống hút Inox 304 kèm cọ rửa DandiHome,1,0,visible,,"Nếu ống hút nhựa gây nguy hại đến môi trường, ống hút giấy vẫn cần sử dụng 1 lớp mỏng nilon bên trong để giữ độ bền, ống hút cỏ mỏng manh chỉ thích hợp dùng cho một lần thì ống hút inox 304 lại là lự...",,2025-12-03,taxable,,1,,,no,no,,,,,1,,39000,39000,,,,https://salt.tikicdn.com/cache/750x750/ts/product/66/58/af/f5711b6a1dc16d142fa3333cb2341a76.jpg,,,,,,,,,0
75673830,simple,8254631671678,Hộp đựng giày nhựa cứng,1,0,visible,,"THÔNG TIN SẢN PHẨM Hộp đựng giày nhựa cứng-Tên sản phẩm : Hộp đựng giầy  thời trang-Tính năng : Giúp bảo quản giầy, guốc, dép ngăn nắp , chống ẩm mốc và bụi bẩn .Thiết kế phù hợp để đựng nhiề...",,2025-12-03,taxable,,1,,,no,no,,,,,1,,258000,258000,,,,https://salt.tikicdn.com/cache/750x750/ts/product/85/3c/73/9f56a6c11cc7ba13d7f7c1a584c5a388.jpg,,,,,,,,,0
278045285,simple,2283419970897,Hộp thủy tinh đựng thức ăn dặm cho bé LocknLock có vạch chia dung tích 230ml x 3 hộp LLG508S3ORG / LLG509S3PUP,1,0,visible,,Hộp thủy tinh đựng thức ăn dặm cho bé LocknLock có vạch chia:- LLG509S3PUP: dung tích 230ml x 3 hộp - màu tím- LLG508S3ORG: dung tích 230ml x 3 hộp - màu camThương Hiệu: LocknLockXuất Xứ: Trung Quốc...,,2025-12-03,taxable,,1,,,no,no,,,,,1,,210000,385000,,,,https://salt.tikicdn.com/cache/750x750/ts/product/ff/a2/2a/4fb8a99c51a804d1badbca0a667d1b1d.png,,,,,,,,,0
56441185,simple,4799090358172,Pin Max 8 + 4 Viên Energizer E92 BP8+4 AAA - Hàng Chính Hãng Model 2020,1,0,visible,,"Pin Max 8 + 4 Viên Energizer E92 BP8+4 AAA là sản phẩm có thể sử dụng cho các loại máy ảnh, điều khiển từ xa, đèn Pin, máy chơi game không dây, máy nghe nhạc MP3 và các thiết bị kỹ thuật số cá nhân k...",,2025-12-03,taxable,,1,,,no,no,,,,,1,,172000,172000,,,,https://salt.tikicdn.com/cache/750x750/ts/product/6a/29/69/a8976da07c9b3646cd9cc00a5bfec6e1.jpg,,,,,,,,,0
240407356,simple,3335518076053,Pin đồng hồ Maxell SR626SW 1.5V,1,0,visible,,Tên sản phẩm : Pin đồng hồ đeo tay Maxell Silver Oxide 1.55V- Mã Sản phẩm : MAXELLSR626SW- Volts : 1.55V- Hãng sản xuất : Maxell Nhật - Xuất xứ : Nhật Bản- Đóng gói : vỉ 1 viên- Sản phẩm chính hãng Ma...,,2025-12-03,taxable,,1,,,no,no,,,,,1,,15000,15000,,,,https://salt.tikicdn.com/cache/750x750/ts/product/85/45/24/4f786b748f193b52c396b0b9469ada92.jpg,,,,,,,,,0
58252038,simple,9566566983030,Bông Lau Nhà Microfiber Xoay 360 Độ Sunhouse KS-CO350M,1,0,visible,,Kích thước phù hợp với hầu hết cây lau nhà 360 độBông Lau Nhà Microfiber Xoay 360 Độ Sunhouse KS-CO350M bao gồm những sợi bông gắn vào 1 đĩa bằng nhựa PP siêu bền. Đĩa nhựa này có kích thước Ø157 mm ...,,2025-12-03,taxable,,1,,,no,no,,,,,1,,30000,35000,,,,https://salt.tikicdn.com/cache/750x750/ts/product/df/d5/68/cef06c00d60e26da8016757e85538410.png,,,,,,,,,0
277815793,simple,7327232171798,Móc dán tường 4 ô tiện dụng- thoải mái mó đồ trong nhà vệ sinh,1,0,visible,,"_ Chất liệu : nhựa ABS_ Dùng được nhiều vị trí trong nhà: cửa ra vào, nhà bếp, phòng khách, phòng ngủ, phòng tắm..._ Giúp sắp xếp gọn gàng cho căn hộ nhà b thêm tươm tất, đẹp đẽ_Sản phẩm không cần ...",,2025-12-03,taxable,,1,,,no,no,,,,,1,,19000,19000,,,,https://salt.tikicdn.com/cache/750x750/ts/product/d2/0f/f3/8243f7d0febec6dec2c26aad5a991e5a.jpg,,,,,,,,,0
67035291,simple,8102410892960,Dép Lỗ Đi Trong Nhà Tắm,1,0,visible,,"Dép Lỗ Đi Trong Nhà Tắm được thiết kế thân thiện mà còn hữu dụng với tính năng massage cho lòng bàn chân của bạn. Có trọng lượng nhẹ, chất liệu và thiết kế khô thoáng, tạo sự thoải mái khi sử dụng, ...",,2025-12-03,taxable,,1,,,no,no,,,,,1,,84000,84000,,,,https://salt.tikicdn.com/cache/750x750/ts/product/7a/fb/31/3d27e6717a515e264ab7369b58f5002b.jpg,,,,,,,,,0
276017828,simple,2180893915496,Chiếu Mát - Chiếu Ngủ Văn Phòng Gấp Gọn Bền Đẹp 5-7 năm,1,0,visible,,"Công Ty TNHH sản xuất và thương mại H&T chuyên sản xuất các sản phẩm từ Tre Trúc tự nhiên như: Chiếu trúc tăm, Chiếu trúc hạt, mành rèm trúc… với chất lượng caoSản phẩm của chúng tôi phong phú về...",,2025-12-03,taxable,,1,,,no,no,,,,,1,,100000,100000,,,,https://salt.tikicdn.com/cache/750x750/ts/product/87/8a/a8/01089878db8b756bbdebb5720a095865.jpg,,,,,,,,,0
276280116,simple,7353384760340,"[PhiênBảnMới] Găng tay Saraya Vinyl Không Bột trong suốt loại dày 5gram, dùng chế biến thực phẩm, vệ sinh - 100 cái/hộp",1,0,visible,,"Thương hiệu: SARAYA.Xuất xứ thương hiệu: NHẬT BẢN.Xuất xứ: Trung Quốc.Quy cách đóng gói: 100 cái/ hộp, 10 hộp/ thùng.Đặc tính & công dụng sản phẩm: Dày, Không mùi, Không bột, Không chứa Latex....",,2025-12-03,taxable,,1,,,no,no,,,,,1,,129000,129000,,,,https://salt.tikicdn.com/cache/750x750/ts/product/68/f4/f2/7ae3adf0b608d844a0016e9b3e7cc33f.png,,,,,,,,,0
275432224,simple,2553177847641,Bộ lau nhà tự vắt thông minh Elmich EL8428,1,0,visible,,"Ưu điểm nổi bậtBộ lau nhà tự vắt thông minh Elmich EL8428 có thiết kế thông minh, giúp các bà nội trợ thuận tiện hơi trong quá trình vệ sinh và dọn dẹp nhà cửa.Bàn xoay 360 độ siêu tiện lợi, chất l...",,2025-12-03,taxable,,1,,,no,no,,,,,1,,603000,1100000,,,,https://salt.tikicdn.com/cache/750x750/media/catalog/producttmp/18/aa/b0/6badd5e7ca8b4e87ab9172776ce578f6.png,,,,,,,,,0
275075355,simple,8106921644771,"Áo mưa cánh dơi vải dù tổ ong siêu bền một đầu, màu sắc giao ngẫu nhiên",1,0,visible,,"THÔNG TIN SẢN PHẨM-Áo mưa choàng vải dù cao cấp là dòng áo mưa choàng 1 người có kích thước lớn. Áo có kích thước lớn big size giúp che kín người, bảo vệ bạn hoàn toàn kể cả những tia nước bắn từ h...",,2025-12-03,taxable,,1,,,no,no,,,,,1,,190000,190000,,,,https://salt.tikicdn.com/cache/750x750/ts/product/7e/02/d6/84ce255c004abadb3abac058aaed52a3.jpg,,,,,,,,,0
274669497,simple,9591170566241,Ca Lọc Dầu Ăn Inox 304 Dày Dặn Dụng Cụ Lọc Nước Inox Dung Tích 1.3L Dụng Cụ Nhà Bếp Ca Lọc Dầu Ăn Kèm Giá Lọc INOX 304 Không Rỉ Sáng Bóng Ca Lọc Dầu Và Tạp Chất Đa Năng Bằng Inox,1,0,visible,,"Ca lọc dầu ăn kèm giá lọc INOX 304 không rỉ sáng bóng. Ca lọc dầu và tạp chất đa năng bằng inox dung tích 1.3 lítTrong cuộc sống hiện đại ngày nay, không gian nhà bếp của mỗi gia đình đã thay đổi hơn...",,2025-12-03,taxable,,1,,,no,no,,,,,1,,36000,39000,,,,https://salt.tikicdn.com/cache/750x750/ts/product/eb/f8/61/141884fbfc9e3bed5fadb0490fcdea11.jpg,,,,,,,,,0
275284151,simple,4916314392214,"Dụng cụ thông tắc bồn cầu, cống bằng khi nén áp lực siêu mạnh",1,0,visible,,"Dụng cụ thông tắc cống khí nén hiệu quả tuyệt đối là lựa chọn tuyệt vời cho việc thông tắc cống bồn cầu, thông tắc cống toilet, thông tắc cống bồn tắm khi bị tắc nghẽn.Máy thông tắc bồn cầu, dụng cụ ...",,2025-12-03,taxable,,1,,,no,no,,,,,1,,235000,235000,,,,https://salt.tikicdn.com/cache/750x750/ts/product/29/79/9f/34f86a86059021e6c62bbac1a5d3fc77.jpg,,,,,,,,,0
275159607,simple,8259293852970,Bình Giữ Nhiệt Lưỡng Tính Tiger MKB-T060 (600ml),1,0,visible,,• Bình giữ nhiệt lưỡng tính MKB-T dung tích 600mlThương hiệu: TigerXuất xứ thương hiệu: Nhật BảnKhả năng giữ nhiệt :+ Giữ nóng trong vòng 1h/6h ở 87ºC/71ºC+ Giữ lạnh trong vòng 6h ở 7ºCKích thướ...,,2025-12-03,taxable,,1,,,no,no,,,,,1,,471750,629000,,,,https://salt.tikicdn.com/cache/750x750/ts/product/91/cf/e2/6e91efebdc791b1720879731ae52cda4.jpg,,,,,,,,,0
274414446,simple,3639941444633,"Găng tay cao su rửa bát, lau dọn, vệ sinh Dài Tay Cổ Chun",1,0,visible,,Thông tin sản phẩm: Găng Tay Siêu Dai Hình Con Hươu Loại Dài Có Bo Chun ( 2 loại: không lót nỉ và có lót nỉ)️ Chất liệu: Cao su️ Kích thước: 17 x 40 cm️ Model: Găng tay rửa bát dáng dài️ Tính năn...,,2025-12-03,taxable,,1,,,no,no,,,,,1,,29000,29000,,,,https://salt.tikicdn.com/cache/750x750/ts/product/4b/66/e2/d7f75cce0f8d968baeef228e9f937c37.jpg,,,,,,,,,0
273716649,simple,2604588910686,"Hộp 100 Găng Tay Cao Su TPE Victoria Bay, Bao Tay Siêu Dai Dùng 1 Lần Làm Bếp Nấu Ăn Vệ Sinh Không Mùi Chống Nhăn",1,0,visible,,"găng tay nấu ăn - găng tay làm bếp siêu dai Victoria Bay chất liệu TPE không mùi chống nhăn hộp 100 cái size MGăng tay nilon siêu dai Victoria Bay, các chị dùng đi chợ, nấu ăn đều rất tiện.Găng tay ...",,2025-12-03,taxable,,1,,,no,no,,,,,1,,12000,19000,,,,https://salt.tikicdn.com/cache/750x750/ts/product/70/46/ee/298a6c2435b9c468edf14eab319c3754.jpg,,,,,,,,,0
273582916,simple,7395332547019,Vỉ 5 Viên Pin CR2032 Maxell Lithium 3V Made in JAPAN - Hàng chính hãng,1,0,visible,,"MAXELL là hãng cung ứng pin Smart key cho các hãng Ô tô , Mô tô khi chìa khóa thông minh hết năng lượng . Thay vì ra hãng thay thế với chi phí vô cùng đắt đỏ Khách hàng có thể tự mua về thay thế với t...",,2025-12-03,taxable,,1,,,no,no,,,,,1,,74000,80000,,,,https://salt.tikicdn.com/cache/750x750/ts/product/7d/cf/e9/e600adca16b8ffec34ed38448427f820.png,,,,,,,,,0
273978786,simple,1258438776492,Đèn năng lượng mặt trời chóng loá Vạn Năng Solar 50W,1,0,visible,,"Vạn Năng Solar cám ơn quý khách hàng trong nước đã tin tưởng và ủng hộ trong nhiều năm qua Hiện nay có nhiều nhà bán hàng giá rẻ, hàng kém chất lượng trên thị trường, vậy làm sao phân biệt ? sau đâ...",,2025-12-03,taxable,,1,,,no,no,,,,,1,,549000,599000,,,,https://salt.tikicdn.com/cache/750x750/ts/product/1a/de/99/cd3dbe0ea1dd20c7ec9457e12a2f64e8.jpg,,,,,,,,,0
253198957,simple,4805632614472,"{Combo 1mx5m} Decal phim màu cách nhiệt chống nắng UV dán kính otô, kính cửa",1,0,visible,,Film dán kính chống nắng cao cấp   - Khổ : 100cm ( +-2cm)   - Combo đặt:   sl 1 = khổ 1mx5md;   sl 2 = khổ 1mx10md;   sl 3 = khổ 1mx15md   - Quy cách : 5m / 10m ( Chọn mua quy cách tr...,,2025-12-03,taxable,,1,,,no,no,,,,,1,,239000,239000,,,,https://salt.tikicdn.com/cache/750x750/ts/product/80/42/c2/1c2c47a3794f80e8423ef22deeb7f391.jpg,,,,,,,,,0
272454935,simple,6461796262847,Bọc trùm máy giặt cửa ngang vải bạt cao cấp chống nước che mát máy ngăn bụi bẩn,1,0,visible,,BỌC MÁY GIẶT VẢI BẠT SIÊU BỀN CHỐNG THẤM NƯỚC- Kích cỡ ngang x sâu x cao (60 x 60-70 x 85cm) chiều sâu có thể chỉnh được vừa cho tất cả các máy giặt lồng ngang từ 6kg đến 12kg- Đằng sau bọc máy giặt...,,2025-12-03,taxable,,1,,,no,no,,,,,1,,195000,195000,,,,https://salt.tikicdn.com/cache/750x750/ts/product/44/d8/c3/41a2287200601b4f68a7dbee22c01b37.png,,,,,,,,,0
239683582,simple,1525514773102,"Ấm Pha Trà Giữ Nhiệt Inox 316 Dung Tích 800ml - 1000ml Hàng Cao Cấp, Phích Giữ Nhiệt Nước Nóng, Lạnh Có Lọc Tiện Dụng - HÀNG CHÍNH HÃNG MINIIN",1,0,visible,,"Ấm Pha Trà Giữ Nhiệt Inox 316 Dung Tích 800ml - 1000ml Hàng Cao Cấp, Phích Giữ Nhiệt Nước Nóng, Lạnh Có Lọc Tiện Dụng - HÀNG CHÍNH HÃNG MINIINẤm Pha Trà Giữ Nhiệt Có Bộ Lọc Trà, Bình Giữ Nhiệt ...",,2025-12-03,taxable,,1,,,no,no,,,,,1,,99000,99000,,,,https://salt.tikicdn.com/cache/750x750/ts/product/3e/88/03/aadc04fc14a3811712f7ae25c7bc1433.png,,,,,,,,,0
248800123,simple,2003020654572,Thùng Rác Cố Định Túi Rác Sọt Rác Nhựa Nguyên Sinh Hạn Chế Mùi Hôi Tiện Lợi Tiết Kiệm Không Gian Cho Văn Phòng Nhà Bếp - 1104,1,0,visible,,"Thùng Rác Nhựa Nguyên Sinh 11L    Thiết kế ốm và cao, phù với mọi ngóc ngách của ngôi nhà, Màu sắc đơn giản nhưng rất tinh tế.    Thiết kế giúp cố định túi rác, chống trượt   Đặc điểm: ...",,2025-12-03,taxable,,1,,,no,no,,,,,1,,73000,131400,,,,https://salt.tikicdn.com/cache/750x750/ts/product/0e/1c/f8/4914ffb5de3a34c6ee99bead50825c8f.jpg,,,,,,,,,0
270508021,simple,9272335123398,Hộp 6 Đũa 6 Muỗng Inox 304 Cao Cấp Phong Cách Sang Trọng - Hàng Chính Hãng,1,0,visible,,"Hộp 6 Đũa 6 Muỗng Inox 304 Cao Cấp Phong Cách Sang Trọng - Hàng Chính HãngBộ sản phẩm thìa ăn và đũa WMF được thiết kế theo phong cách ăn uống của người Nhật. Thiết kế kiểu dáng đơn giản, thanh thoát...",,2025-12-03,taxable,,1,,,no,no,,,,,1,,109000,199000,,,,https://salt.tikicdn.com/cache/750x750/ts/product/6f/d0/5e/b188cf867294a5a8f9c3dbd9cf15ee3e.png,,,,,,,,,0
257770304,simple,4127330491359,Ly nhựa 2 lớp LocknLock HAP507VOLH Rainbow - kèm ống hút 750ml - Màu cầu vồng,1,0,visible,,...,,2025-12-03,taxable,,1,,,no,no,,,,,1,,130000,239000,,,,https://salt.tikicdn.com/cache/750x750/ts/product/fe/2b/43/82720891ddab10a1ee38183b7fa1b8e7.jpg,,,,,,,,,0
204083683,simple,7788359265369,"Đĩa Giấy Nến Thấm Dầu Lót Nồi Chiên Không Dầu, Chịu Nhiệt, Không Dính, Hút Dầu Mỡ",1,0,visible,,"Đóng gói:  1 set giấy nến.️ Tính năng Giấy nến có tính năng thấm hút dầu mỡ, giúp đồ ăn ngon hơn và tốt cho sức khỏe. Giúp đồ ăn không tiếp xúc với đáy nồi chiên, đồ ăn khó bị cháy hơn và giữ được n...",,2025-12-03,taxable,,1,,,no,no,,,,,1,,10000,10000,,,,https://salt.tikicdn.com/cache/750x750/ts/product/96/f4/62/a9417320bd261d5494abbf522efe794b.jpg,,,,,,,,,0
248684989,simple,1339181064462,Ổ Cắm Điện Đa Năng Kèm Cổng USB Có Công Tắc Chống Giật Chống Cháy Chất Lượng Cao Deli - Hàng Chính Hãng - ET407 408,1,0,visible,,Ổ Cắm Điện Đa Năng Kèm Cổng USB Có Công Tắc Chống Giật Chống Cháy Chất Lượng Cao - Hàng Chính Hãng - ET407 408 Thông tin sản phẩm:Mã sản phẩm: ET407 ET408Độ dài dây: 2mPhân loại:  - ET407: 2 ổ đi...,,2025-12-03,taxable,,1,,,no,no,,,,,1,,255000,459000,,,,https://salt.tikicdn.com/cache/750x750/ts/product/64/f0/e8/76ef266dbb58def623f7fa7bb4ccfdf5.png,,,,,,,,,0
274285819,simple,6174876131217,"Đĩa Giấy Bạc Lót Nồi Chiên Không Dầu, Khay Bạc Nướng Thực Phẩm (Nhiều Cỡ)",1,0,visible,,"Đĩa Giấy Bạc Lót Nồi Chiên Không Dầu, Khay Bạc Nướng Thực Phẩm Đóng gói:  1 set đĩa giấy bạc️ Tính năng Giúp đồ ăn không tiếp xúc với đáy nồi chiên, đồ ăn khó bị cháy hơn và giữ được nước và hương v...",,2025-12-03,taxable,,1,,,no,no,,,,,1,,28500,30000,,,,https://salt.tikicdn.com/cache/750x750/ts/product/79/8e/88/1fdaba931b0d788f6401d7911dbe2b3b.jpg,,,,,,,,,0
274054635,simple,1254353428485,Dao nhà bếp đa năng Elmich Diamond EL8408 - Hàng Chính Hãng,1,0,visible,,"Dao nhà bếp đa năng Elmich Diamond EL8408Thông tin sản phẩm1. Dao được làm từ chất lượng thép Diamond cao cấp, loại thép thường được dùng cho dao của đầu bếp với lưỡi dao sắc bén và bền theo thời gi...",,2025-12-03,taxable,,1,,,no,no,,,,,1,,199000,529000,,,,https://salt.tikicdn.com/cache/750x750/media/catalog/producttmp/9c/77/61/0c55e355aa8146f2e4f220376c794d81.png,,,,,,,,,0
276962715,simple,4567595621816,"Tạp dề hoa cúc, tạp dề chống thấm",1,0,visible,,TẠP DỀ CHỐNG THẤM CÓ TÚI ĐỂ ĐIỆN THOẠI VÀ CHỖ LAU TAY TIỆN DỤNG   Mã tạp dề này đẹp quá các mẹ ơiiii. Có cả chỗ để điện thoại này rồi lại còn thiết kế cả chỗ lau tay 2 bên hông dạng khăn b...,,2025-12-03,taxable,,1,,,no,no,,,,,1,,25000,25000,,,,https://salt.tikicdn.com/cache/750x750/ts/product/61/f0/67/5bd26265496872b0a6df6b3f166d8090.jpg,,,,,,,,,0
